{
  "chapter_id": "chapter-0005",
  "accepted_revision_sha256": "f627dd586df7aa3238d6722148adf34f5bf1c4efaf29f254344d138e31525aaa",
  "state_deltas": [
    {
      "fact_id": "chapter-0005-character-lu-chenyuan-001",
      "asset_id": "character_lu_chenyuan",
      "field_path": "character.current_procedural_status",
      "operation": "set",
      "before": "确认明日辰时到场，但不替任何住户陈述未亲见之事",
      "after": "已到场完成本地复核，并被要求午后护阵旁观重验继续在场；凡本地残页复核不得缺席"
    },
    {
      "fact_id": "chapter-0005-npc-registrar-qiu-shen-001",
      "asset_id": "npc_registrar_qiu_shen",
      "field_path": "npc.local_review_decision",
      "operation": "set",
      "before": "顾家附录暂封，灰物由莫井兰暂带，三日内随顾家复核再验；苏晚验灯不熄",
      "after": "顾家附录继续封存；守灯前三句保留，未知来源不入；护阵旁观追加残页改列次序待核"
    },
    {
      "fact_id": "chapter-0005-npc-registrar-qiu-shen-002",
      "asset_id": "npc_registrar_qiu_shen",
      "field_path": "npc.current_local_notice",
      "operation": "set",
      "before": "以冷金小印薄纸通知明日辰时顾家户灯、守灯口述及泥灯巷护阵旁观均不得缺席",
      "after": "已发出今日午后泥灯巷护阵旁观落点重验通知，并列明顾家户灯留衙、莫井兰携陶片、陆沉渊到场的条件"
    },
    {
      "fact_id": "chapter-0005-npc-mo-jinglan-001",
      "asset_id": "npc_mo_jinglan",
      "field_path": "npc.current_witness_participation",
      "operation": "set",
      "before": "决定携陶片赴明日辰时复核，但不交出陶片；若仇慎索取则不再陈述后半句",
      "after": "已在复核中陈述顾家旧灰、补墨灰凉无油及断纹相反三句；陶片仍暂带，午后须携带在场"
    },
    {
      "fact_id": "chapter-0005-npc-su-wan-001",
      "asset_id": "npc_su_wan",
      "field_path": "npc.current_procedural_limit",
      "operation": "set",
      "before": null,
      "after": "午后可拒绝验灯，但不得替陆沉渊认灰"
    },
    {
      "fact_id": "chapter-0005-location-mudlamp-lane-001",
      "asset_id": "faction_mudlamp_lane",
      "field_path": "faction.current_protection_array_condition",
      "operation": "set",
      "before": "巷口泥灯焰尖降低、灯座裂为两道，墙上护阵纹短暂亮起后复暗；仅以旧砖和扫帚暂时扶正灯座与灯罩",
      "after": "护阵旁观落点被列为今日午后重验对象，尚未完成复核或修补"
    },
    {
      "fact_id": "chapter-0005-faction-life-registry-office-001",
      "asset_id": "faction_life_registry_office",
      "field_path": "faction.current_local_enforcement_phase",
      "operation": "set",
      "before": "命籍衙已于夜间送达明日辰时的护阵旁观追加通知，下一次本地监督仍定于明日辰时",
      "after": "辰时复核已完成并将护阵旁观追加残页列为次序待核；午后转入泥灯巷重验监督"
    },
    {
      "fact_id": "chapter-0005-faction-life-registry-office-002",
      "asset_id": "faction_life_registry_office",
      "field_path": "faction.next_local_review_schedule",
      "operation": "set",
      "before": "明日辰时顾家户灯、守灯口述与泥灯巷护阵旁观须到场；无人认领旁观则按无证护阵记",
      "after": "今日午后在泥灯巷重验护阵旁观落点；顾家户灯留衙至验毕，莫井兰携陶片、陆沉渊到场，人或物缺一按拒验续记"
    },
    {
      "fact_id": "chapter-0005-technique-ledger-recognition-001",
      "asset_id": "technique_ledger_recognition",
      "field_path": "technique.current_local_ash_trace_observation",
      "operation": "set",
      "before": "巷口泥灯座裂缝灰在靠近命籍衙印痕处折转，留下半指宽冷灰空白，未沿护阵纹延展",
      "after": "顾家附录补墨灰位于冷金印下；护阵旁观残页署时旁灰浮在墨上且被冷金截断，右页存在无法与“昨夜追加”同时自证的局部次序"
    },
    {
      "fact_id": "chapter-0005-relationship-mudlamp-lane-trust-001",
      "asset_id": "bond_mudlamp_lane_trust",
      "field_path": "emotional_bond.current_witness_commitment",
      "operation": "set",
      "before": "莫井兰与顾婶均决定赴核，但各自限定见证范围；顾婶拒绝让孩童命灯受验，莫井兰拒绝代签未知来源或交出陶片",
      "after": "莫井兰保留前三句限于所见的陈述，拒绝补入未知来源；午后继续以暂带陶片的限定方式到场"
    },
    {
      "fact_id": "chapter-0005-relationship-mother-su-wan-001",
      "asset_id": "bond_mother_su_wan",
      "field_path": "emotional_bond.current_visibility_of_lu_chenyuan_backlash",
      "operation": "set",
      "before": "苏晚看见陆沉渊掌心的青白印和左眼下无法遮掩的焦黑裂纹",
      "after": "苏晚在识账反噬中按住陆沉渊腕上发抖的手，未替他认灰或触碰残页"
    },
    {
      "fact_id": "chapter-0005-information-revealed-account-errors-001",
      "asset_id": "state_ledger_revealed_account_errors",
      "field_path": "state_ledger.current_local_evidence_status",
      "operation": "set",
      "before": "附录已并列保有冷灰、顾婶掌背红点及莫井兰限于所见的口述，仍未成为改账依据",
      "after": "护阵旁观追加残页被确认存在局部次序疑处，列为待核；未被认定为顾家折记错误、护阵追加无效或改时原因的证明"
    },
    {
      "fact_id": "chapter-0005-timeline-local-enforcement-001",
      "asset_id": "faction_life_registry_office",
      "field_path": "faction.current_local_enforcement_phase",
      "operation": "set",
      "before": "命籍衙已于夜间送达明日辰时的护阵旁观追加通知，下一次本地监督仍定于明日辰时",
      "after": "辰时复核后，程序推进至今日午后的泥灯巷护阵旁观落点重验"
    },
    {
      "fact_id": "chapter-0005-physical-state-protagonist-strain-001",
      "asset_id": "state_ledger_protagonist_strain",
      "field_path": "state_ledger.eye_pattern_burn",
      "operation": "set",
      "before": "本次识账后焦黑纹路再向下爬，左眼疼胀并持续掉落黑屑",
      "after": "识账时左眼下焦纹沿颧骨再绽开一小截，皮肉现烧焦气味并落下黑屑；银灰火屑未散"
    },
    {
      "fact_id": "chapter-0005-physical-state-protagonist-strain-002",
      "asset_id": "state_ledger_protagonist_strain",
      "field_path": "state_ledger.cold_ash_cough_frequency",
      "operation": "set",
      "before": "本次夜间识账后再次咳出冷灰，落在巷口泥地",
      "after": "本次识账后咳出冷灰落在命审台角，并被冷金小印压入在场认痕"
    },
    {
      "fact_id": "chapter-0005-physical-state-protagonist-strain-003",
      "asset_id": "state_ledger_protagonist_strain",
      "field_path": "state_ledger.bone_fissure_severity",
      "operation": "set",
      "before": "识账后胸骨裂口感使呼吸受阻，撑灯座时掌骨出现摩擦声",
      "after": "薄纸衙印牵动掌心旧印后掌骨再响，胸口裂口感骤紧，需扶住台沿喘息"
    },
    {
      "fact_id": "chapter-0005-physical-state-registry-exposure-001",
      "asset_id": "state_ledger_half_life_registry_exposure",
      "field_path": "state_ledger.registry_locking_sign",
      "operation": "set",
      "before": "新咳出的冷灰沾住已签传核纸衙印，使印痕泛出暗红；仇慎当场要求留下该纸",
      "after": "识账所咳冷灰被冷金小印压入在场认痕，薄纸衙印牵出暗红印线锁到陆沉渊掌心旧印"
    }
  ],
  "resolved_audit_ids": []
}
