{
  "chapter_id": "chapter-0015",
  "accepted_revision_sha256": "21c7a37b14cf440e1d2e09f4cd774a4b75562543682cac2c69544d4b2141ade1",
  "state_deltas": [
    {
      "fact_id": "chapter-0015-character-lu-chenyuan-001",
      "asset_id": "character_lu_chenyuan",
      "field_path": "character.current_action_limit",
      "operation": "set",
      "before": "未施展识账，不辨灰、不以血口抵印，仅接受一次纸面转动并在承压后停止",
      "after": "未施展识账、未辨灰、未抵印、未碰砖；纸展开后血口再开并退出，未继续行动"
    },
    {
      "fact_id": "chapter-0015-character-lu-chenyuan-002",
      "asset_id": "character_lu_chenyuan",
      "field_path": "character.current_procedural_status",
      "operation": "set",
      "before": "下一次只验半印与纸断处的远近次序；须带未愈掌心血口到场，见证可拒可撤",
      "after": "明日申前先验在场次序；须带未愈血口，只看不识账、不碰阵；见证可来、可拒、可撤"
    },
    {
      "fact_id": "chapter-0015-npc-registrar-qiu-shen-001",
      "asset_id": "npc_registrar_qiu_shen",
      "field_path": "npc.local_review_decision",
      "operation": "set",
      "before": "止于一次转纸；纸与半枚印分开封记，不再转纸、不贴纸、不碰阵",
      "after": "完成一次展开折纸复核；纸与半印仍分开，未贴纸、未碰阵，缘故与归属不记"
    },
    {
      "fact_id": "chapter-0015-npc-registrar_qiu_shen-002",
      "asset_id": "npc_registrar_qiu_shen",
      "field_path": "npc.current_local_notice",
      "operation": "set",
      "before": "下一次先验半印与纸断处的远近次序；纸不进阵、印不贴纸；各见证人只认各自见闻",
      "after": "明日申前先验在场次序；纸先到、半印后到；陆沉渊只看，苏晚可拒验，莫井兰可来、可不来或撤回未封句子"
    },
    {
      "fact_id": "chapter-0015-npc-registrar-qiu-shen-003",
      "asset_id": "npc_registrar_qiu_shen",
      "field_path": "npc.current_seal_condition",
      "operation": "set",
      "before": "半枚印未出袖但冷金痕爬过第二指节，手背失血色，两根手指僵硬蜷住",
      "after": "半枚印仍未露面；袖中半印撞腕骨并使其僵硬左手进一步承压"
    },
    {
      "fact_id": "chapter-0015-npc_mo_jinglan-001",
      "asset_id": "npc_mo_jinglan",
      "field_path": "npc.current_witness_participation",
      "operation": "set",
      "before": "只保留今日两句见证；下一次可来可不来",
      "after": "仅确认纸离灯座、纸展开一次、黑点上移停空白边、印未出袖；不认血与纸线关系，明日是否到场未承诺"
    },
    {
      "fact_id": "chapter-0015-npc_su_wan-001",
      "asset_id": "npc_su_wan",
      "field_path": "npc.current_procedural_limit",
      "operation": "set",
      "before": "同意仅转纸一次；陆沉渊血口再开即停，并继续拒绝验灯、取灯或代验",
      "after": "在血口透布后立即叫停；继续拒绝验灯、取灯、代验，也不允许将陆沉渊的手贴到任何东西"
    },
    {
      "fact_id": "chapter-0015-location-mudlamp-lane-001",
      "asset_id": "faction_mudlamp_lane",
      "field_path": "faction.current_protection_array_condition",
      "operation": "set",
      "before": "旧砖仍陷湿泥，灯座裂口无遮无挡且冷灰积在缝底；护阵未修复，火星未变亮",
      "after": "旧砖仍陷原处，裂口无遮无挡，火星一度压低至细红后未恢复；护阵纹全程未亮，护阵未修复"
    },
    {
      "fact_id": "chapter-0015-location-mudlamp-lane-002",
      "asset_id": "faction_mudlamp_lane",
      "field_path": "faction.current_communal_response",
      "operation": "set",
      "before": "一扇门闩木落下，另一扇仅留两指宽后合上；共同体未提供命火或统一见证",
      "after": "巷中仍无人出灯；门闩落下，顾婶闭门，未形成共同出灯或替代见证"
    },
    {
      "fact_id": "chapter-0015-faction-life-registry-office-001",
      "asset_id": "faction_life_registry_office",
      "field_path": "faction.current_local_enforcement_phase",
      "operation": "set",
      "before": "完成一次受限转纸复核并分别记录纸、半印、黑点、掌心血口与见证边界",
      "after": "完成一次受监督的纸面展开复核；记录纸靠近、火低、上点下移、血口再开，仍不记录缘故或归属"
    },
    {
      "fact_id": "chapter-0015-faction-life-registry-office-002",
      "asset_id": "faction_life_registry_office",
      "field_path": "faction.next_local_review_schedule",
      "operation": "set",
      "before": "下一次只验半印与纸断处的远近次序；纸不进阵、印不贴纸；见证可拒可撤",
      "after": "明日申前先验在场次序：纸先到、半印后到；陆沉渊带血口只看，苏晚可拒验，莫井兰可来、可拒、可撤"
    },
    {
      "fact_id": "chapter-0015-technique-ledger-recognition-001",
      "asset_id": "technique_ledger_recognition",
      "field_path": "technique.current_use_status",
      "operation": "set",
      "before": "本章未施展识账；陆沉渊主动闭眼，未对灰痕、来源或同源作判断",
      "after": "本章仍未施展识账；仅以现场肉眼观察纸、印、黑点和血口，未判断来源、同源或归属"
    },
    {
      "fact_id": "chapter-0015-relationship-mudlamp-lane-trust-001",
      "asset_id": "bond_mudlamp_lane_trust",
      "field_path": "emotional_bond.current_witness_commitment",
      "operation": "set",
      "before": "见证继续分句且不可互补；下一次均可拒绝或撤回",
      "after": "见证继续逐句分离且不可互补；莫井兰不认血与纸线关系，顾婶见证在火再低后终止，下一次不承诺到场"
    },
    {
      "fact_id": "chapter-0015-relationship-mother-su-wan-001",
      "asset_id": "bond_mother_su_wan",
      "field_path": "emotional_bond.current_visibility_of_lu_chenyuan_backlash",
      "operation": "set",
      "before": "苏晚亲见一次转纸后血口渗血、胸骨钝响和咳灰，并包扎掌心、扶住陆沉渊",
      "after": "苏晚亲见纸展开后掌心血口再开、胸骨再次钝响、冷灰落在衣摆，并在其退出后扶住他"
    },
    {
      "fact_id": "chapter-0015-emotion-mudlamp-lane-001",
      "asset_id": "bond_mudlamp_lane_trust",
      "field_path": "emotional_bond.current_collective_emotion",
      "operation": "set",
      "before": "退避继续具体化为一门落闩、一门仅留两指宽后合上；共同体仍未提供命火或统一见证",
      "after": "退避继续；无人出灯，顾婶因火再低闭门，莫井兰未承诺明日到场"
    },
    {
      "fact_id": "chapter-0015-emotion-registrar-qiu-shen-001",
      "asset_id": "npc_registrar_qiu_shen",
      "field_path": "npc.current_visible_fear",
      "operation": "set",
      "before": "仇慎因黑点、掌心血口和半印反应迅速出汗，停止继续试验并改为分项记录",
      "after": "仇慎持续出汗、左手僵硬，仍以逐句记录、分开封记和保留空位控制程序风险"
    },
    {
      "fact_id": "chapter-0015-information-revealed-account-errors-001",
      "asset_id": "state_ledger_revealed_account_errors",
      "field_path": "state_ledger.current_local_evidence_status",
      "operation": "set",
      "before": "一次转纸后确认上方黑点下移、掌心血口渗血；下方黑点不动、空白未合；缘故与归属仍未明",
      "after": "纸展开一次后，上方黑点下移至空白边并停住；下方黑点不动；血口在纸展平后再开；三者同场但仍未认定缘故、同源或归属"
    },
    {
      "fact_id": "chapter-0015-information-local-procedure-001",
      "asset_id": "state_ledger_revealed_account_errors",
      "field_path": "state_ledger.current_local_procedure_result",
      "operation": "set",
      "before": "纸与半印继续分开封记；顾家户灯不归、折记不改、返还附录照旧",
      "after": "纸与半印继续分开封记；顾家户灯仍留衙，折记不改，旧追缴不撤，未形成归属或改账结论"
    },
    {
      "fact_id": "chapter-0015-information-local-limit-001",
      "asset_id": "state_ledger_revealed_account_errors",
      "field_path": "state_ledger.current_local_inference_limit",
      "operation": "set",
      "before": "只能确定纸的方向会改变现场反应，不能确定反应原因、灰痕同源或陆沉渊碰过纸",
      "after": "仅能确定纸靠近和展开伴随火低、上点移动及血口再开；不能确定因果、来源、同源、归属或接触事实"
    },
    {
      "fact_id": "chapter-0015-hook-cinder-seal-rain-001",
      "asset_id": "foreshadowing_cinder_seal_rain",
      "field_path": "foreshadowing.current_manifestation",
      "operation": "set",
      "before": "纸转半圈后上方黑点下移至空白边缘并停住；下方黑点始终未动，空白未合",
      "after": "纸展开时上方黑点下滑至针尖空白边并停住；仇慎袖中半印碰腕骨时黑点仅颤动，仍未越过空白；下方黑点未动"
    },
    {
      "fact_id": "chapter-0015-hook-cinder-seal-rain-002",
      "asset_id": "foreshadowing_cinder_seal_rain",
      "field_path": "foreshadowing.next_review_hook",
      "operation": "set",
      "before": "下一次只验半印与纸断处的远近次序；若纸、印或在场次序改变，今日结果不得续认",
      "after": "明日申前先验纸与半印的在场次序；今日见证若缺席或撤回不得续认，窄纸底部留空待到场者决定是否补记"
    },
    {
      "fact_id": "chapter-0015-timeline-local-enforcement-001",
      "asset_id": "faction_life_registry_office",
      "field_path": "faction.current_local_enforcement_phase",
      "operation": "set",
      "before": "天未亮完成一次纸面半圈转动复核；当前程序停在下一次半印与纸断处的远近、在场次序复核",
      "after": "天亮前完成纸展开一次的监督复核；当前程序停在明日申前纸先到、半印后到的在场次序复核"
    },
    {
      "fact_id": "chapter-0015-physical-state-protagonist-strain-001",
      "asset_id": "state_ledger_protagonist_strain",
      "field_path": "state_ledger.bone_fissure_severity",
      "operation": "set",
      "before": "一次转纸后掌心血口渗出一滴血，胸骨再次钝响；包扎后仍向苏晚肩侧弯伏",
      "after": "纸完全展开后胸骨再次钝响，随后起身时裂处磨响；陆沉渊无法自行站稳并被苏晚按回"
    },
    {
      "fact_id": "chapter-0015-physical-state-protagonist-strain-002",
      "asset_id": "state_ledger_protagonist_strain",
      "field_path": "state_ledger.eye_pattern_burn",
      "operation": "set",
      "before": "右眼仍只能看见重影与银灰火屑；闭眼后再睁开时纸上字全是重影，未恢复视力",
      "after": "右眼持续重影并在纸展开后进一步发黑；左眼焦壳下继续掉落碎屑，视力未恢复"
    },
    {
      "fact_id": "chapter-0015-physical-state-protagonist-strain-003",
      "asset_id": "state_ledger_protagonist_strain",
      "field_path": "state_ledger.cold_ash_cough_frequency",
      "operation": "set",
      "before": "本章再次咳出冷灰，落在自身衣摆上，未越过墙根",
      "after": "纸完全展平后再次咳出冷灰，全部落在衣摆，未越过墙根、纸张或灯座"
    },
    {
      "fact_id": "chapter-0015-physical-state-registry-exposure-001",
      "asset_id": "state_ledger_half_life_registry_exposure",
      "field_path": "state_ledger.registry_locking_sign",
      "operation": "set",
      "before": "半印靠近时暗红线由腕内偏向仇慎袖口，远离时略松；旧追缴未解除，掌心血口仍为下一次到场证据",
      "after": "纸展开时掌心暗红线被勒紧并沿腕内拖行；半印未出袖，远离后暗线仅略松，旧追缴与血口证据继续保留"
    },
    {
      "fact_id": "chapter-0015-physical-state-mother-lamp-001",
      "asset_id": "state_ledger_mother_life_lamp_countdown",
      "field_path": "state_ledger.current_visible_lamp_consequence",
      "operation": "set",
      "before": "苏晚掌背冷光仍在皮下明灭，正文未显示裂纹合拢或命灯缓解",
      "after": "苏晚掌背暗冷光漫至腕骨，正文未显示裂纹合拢或命灯缓解"
    }
  ],
  "resolved_audit_ids": []
}
